{

  "$schema": "http://json-schema.org/draft-07/schema#",

  "additionalProperties": false,

  "definitions": {

    "NullableString": {

      "type": [

        "string",

        "null"

      ]

    }

  },

  "properties": {

    "agent_id": {

      "type": "string"

    },

    "agent_type": {

      "type": "string"

    },

    "cwd": {

      "type": "string"

    },

    "hook_event_name": {

      "const": "PreToolUse",

      "type": "string"

    },

    "model": {

      "type": "string"

    },

    "permission_mode": {

      "enum": [

        "default",

        "acceptEdits",

        "plan",

        "dontAsk",

        "bypassPermissions"

      ],

      "type": "string"

    },

    "session_id": {

      "type": "string"

    },

    "tool_input": true,

    "tool_name": {

      "type": "string"

    },

    "tool_use_id": {

      "type": "string"

    },

    "transcript_path": {

      "$ref": "#/definitions/NullableString"

    },

    "turn_id": {

      "description": "Codex extension: expose the active turn id to internal turn-scoped hooks.",

      "type": "string"

    }

  },

  "required": [

    "cwd",

    "hook_event_name",

    "model",

    "permission_mode",

    "session_id",

    "tool_input",

    "tool_name",

    "tool_use_id",

    "transcript_path",

    "turn_id"

  ],

  "title": "pre-tool-use.command.input",

  "type": "object"

}
