{
  "session_id": "<SESSION_ID>",
  "turn_id": "<TURN_ID>",
  "transcript_path": "<TRANSCRIPT>",
  "cwd": "<CWD>",
  "hook_event_name": "PreToolUse",
  "model": "gpt-6.1-sol",
  "permission_mode": "bypassPermissions",
  "tool_name": "apply_patch",
  "tool_input": {
    "command": "*** Begin Patch\n*** Update File: mv.txt\n*** Move to: moved.txt\n@@\n-mv me\n+moved\n*** End Patch"
  },
  "tool_use_id": "<TOOL_USE_ID>"
}
