{
  "session_id": "<SESSION_ID>",
  "turn_id": "<TURN_ID>",
  "transcript_path": "<TRANSCRIPT>",
  "cwd": "<CWD>",
  "hook_event_name": "PreToolUse",
  "model": "gpt-6.1-sol",
  "permission_mode": "bypassPermissions",
  "tool_name": "collaborationspawn_agent",
  "tool_input": {
    "task_name": "read_notes",
    "message": "<OPAQUE-ENCRYPTED-BLOB>"
  },
  "tool_use_id": "<TOOL_USE_ID>"
}
